title,link,description,bloggername,bloggerlink,postdate
남양주 폐차장 기사를 보내드려 차량을 입고시킵니다,https://blog.naver.com/seeon-bs/223122891075,"2023년 남양주 조기폐차는 1,575대를 조기폐차할 <b>예산</b>을 확보하여 신청 접수 받았습니다. <b>예산</b> 범위 내에서 선착순 접수였으며 <b>예산</b>이 소진되어 6월 5일 마감하였습니다. 2023년 하반기에는 추가로 <b>예산</b>이... ",하하호호,blog.naver.com/seeon-bs,20230607
1톤크레인중고 동해433 4륜 2천킬로 신차,https://blog.naver.com/5012army/223122890492,신차급 1톤크레인중고 동해433 마음에는 무조건 들수밖에 없는데 <b>예산</b>이 부족한 경우가 있겠죠. 고가의 장비차량을 현금으로 주고 사는 사업장은 사실상 잘 없죠 그렇기에 분할납부를 알아봐야 하는데... ,조금전,blog.naver.com/5012army,20230607
결혼 예물 고민하다가 마침내 최종 선택!,https://blog.naver.com/rldqo5/223122889985,저희가 원하는 취향이랑 대략적인 <b>예산</b> 말씀드리니까 정말 친절하게 수십가지 반지를 보여주시고 다 끼어볼 수 있게 해주셨어요. 일리아스 다이아 반지 영롱~ 그래서 반지를 하나하나 껴보면서 우리가 원하는... ,rldqo5님의 블로그,blog.naver.com/rldqo5,20230607
[시공갤러리] 육사 청헌당 한지창호,https://blog.naver.com/sdb2010/223122889960,이 건물은 조선말기의 삼군부 청사입니다 태릉 육사 박물관 청헌당이라는 문화재 건물 한지창호 시공이고 도배와 한지 장판은 다시 <b>예산</b>결재받아 추후 하기로... 삼일째 문만 바르니 조금 지루하지만 한지의... ,도배의 민족,blog.naver.com/sdb2010,20230607
블로그씨는 더워지는 날씨에 입맛을 잃어가요. 이른 더위를... ,https://blog.naver.com/wldmsl1994/223122888941,중인 #<b>예산</b>시장 갔다가 한바퀴 쭉 구경하다가 먹고 싶은 메뉴가 없어 삽교읍까지 나가 구룡각을... #구룡각 #짬뽕밥 #간짜장 #예당저수지 뷰 맛집인 <b>예산</b> 카페 #해월 찾았어요 - 손님이 너무 많기도 하고... ,맛집의 흔적,blog.naver.com/wldmsl1994,20230607
두촌면 인근(隣近)에 춘원도청(春原道廳) 춘원도의회 신설 홍천... ,https://blog.naver.com/msk7613/223122889302,"정부·국회 등을 회덕(懷德)특별시(현도,문의,형강,우술,회덕,비풍,유성,연기 등)에 두는 입헌군주제(立憲君主制) 헌법(憲法) 개정해야 http://blog.naver.com/msk7613 1897년 10월 12일 천자국(天子國) 대한국(大韓國1897 - )... ",김민수의 대한국 황실 조선국 왕실 역사 고궁 박물관,blog.naver.com/msk7613,20230607
특허 출원번호조회 어디서 할 수 있나요? 바로 여기서!,https://blog.naver.com/58w635jj/223122888693,미리 <b>예산</b>을 설정하는 것이 좋습니다따라서 컨설팅 결과를 보장하는 업체는 신뢰할 수 없으며... 파악하고 <b>예산</b>을 세워야 합니다 출원번호조회문서 작성 과정에서 발생하는 실수나 미숙한 부분은 지적재산권... ,58w635jj님의 블로그,blog.naver.com/58w635jj,20230607
"여름방학, 유럽 배낭 여행을 떠나기 전 알아야 할 사항",https://blog.naver.com/dfs4cl8p/223122888733,"호스텔은 저렴한 가격에 깨끗한 환경을 제공해주기 때문에 <b>예산</b>을 절약하면서도 편안한 숙박을 즐길 수 있습니다. 마지막으로, 현지 경찰에 도움을 요청할 수 있는 준비를 해두시는 것이 좋습니다. 언제든지... ",dfs4cl8p님의 블로그,blog.naver.com/dfs4cl8p,20230607
"포항맛집 최상급 소갈비 숯불구이, 포갈집",https://blog.naver.com/wertg345/223122888410,가격도 생각보다 저렴해서 <b>예산</b>을 아낄 수 있었습니다. 다음에는 애인과 함께 방문하고 싶네요. 포갈집의 장점은 양이 적은 대신 가격이 저렴하다는 점입니다. 다양한 메뉴를 시켜서 맛보기도 좋습니다. 포갈살... ,wertg345님의 블로그,blog.naver.com/wertg345,20230607
[필독] 사업주 대표님들께서 꼭 아셔야 할 정책자금!,https://blog.naver.com/ck42420/223122888708,"정부지원 정책자금이란 중소기업, 소상공인 경영을 하시는데 정부의 <b>예산</b>으로 자금을 지원하는 제도입니다. 정부 정책자금을 꼭 알아야 하는 이유는 2% ~ 5%대 금리로 1금융권에서 장기간 이용 할수 있기... ",CK홀딩스님의 블로그,blog.naver.com/ck42420,20230607
2023년 6월 2일 상승률 TOP30,https://blog.naver.com/worldtravellerdj/223122886591,법안 <b>예산</b> 불확실성 해소로 신재생에너지 투자 활성화 기대감 → 풍력사업... 법안 <b>예산</b> 불확실성 해소로 신재생에너지 투자 활성화 기대감 → 태양광발전사업 → 신재생에너지관련주 부각 12.... ,Useful,blog.naver.com/worldtravellerdj,20230607
관사(a / the),https://blog.naver.com/aaiibb/223122886782,"프로젝트의 <b>예산</b> The budge of a project 회사나 정부의 리더들 The leaders of a company or... 리더들이 <b>예산</b>을 세울때, 우선순위에 대한 상당한 의견충돌이 있다. When the... ",파워워프~,blog.naver.com/aaiibb,20230607
"내포 1층 10평대 상가임대/시민공원, 시민광장 뷰/옷가게, 카페... ",https://blog.naver.com/dal_eeee/223122887122,"(홍성+<b>예산</b>) 상가,사무실 전문 임대, 매매 문의 041-633-9639 보증금 1,500만원 월세 80만원 월관리비... (홍성+<b>예산</b>) 상가,사무실 전문 임대, 매매 문의 041-633-9639 해가뜨면 공인중개사사무소 등록번호... ",해가뜨면부동산/041-633-9639,blog.naver.com/dal_eeee,20230607
아뜰리에 분위기 성향 파악하는 방법 / 프로젝트 중심,https://blog.naver.com/kddoy/223122886402,"애초에 정해진 <b>예산</b>에서 플레이하고 투명하게 진행되는 것이 장점이다. 다만, 앞서 말한 것 처럼 큰 돈이 아닐 수도 있다. 즉 모든 프로젝트의 설계비가 크지 않아서 때로는 매출에 큰 도움이 안될 수 있다.... ",N년차 공간 디자이너 김잇팁의 일상 꿀팁,blog.naver.com/kddoy,20230607
"스웨덴 일상 | 초여름, 운동복 팝업스토어, 아이스크림만 먹는... ",https://blog.naver.com/500summers/223122886503,"워홀시절, 정말 타이트한 <b>예산</b>에 매번 얻어먹었던 게 죄송스러웠는데 뭔가 드디어 내가 다시 돌려드릴 수 있다는 것에 감사했다. 그리고 이 바삭바삭한 삼겹살과 같이 먹는 이 메뉴 정말 맛있더라,, 여름에 꼭... ",Sthl journal,blog.naver.com/500summers,20230607
중산2동타일공사 미용실타일공사 병원타일공사 음식점타일,https://blog.naver.com/choi4122/223122885830,"도기질 타일과 자기질 타일은 각각 장단점이 있으므로, 사용 용도와 <b>예산</b>에 따라 적합한 타일을 선택하는 것이 중요합니다. 도기질 타일은 내구성이 덜 중요한 벽면 마감재로 적합하며, 자기질 타일은... ",국산/수입타일 납품,blog.naver.com/choi4122,20230607
"美 법원, SEC 요청 바이낸스US 자산 동결 승인",https://blog.naver.com/copytrading/223122885748,"美 법원, SEC 요청 바이낸스US 자산 동결 승인 미국 법원이 미국 증권거래위원회(SEC)의 요청을 받아들여 바이낸스 US와 자회사인 BAM 매니지먼트와 BAM 트레이딩의 자산을 동결했다고 코인텔레그래프가... ",한발 빠른 코인정보,blog.naver.com/copytrading,20230607
그랜드메종 오레노후렌치 [도쿄 레스토랑 피아노연주]... ,https://blog.naver.com/pomeranianpopo/223122885288,정도 <b>예산</b> 잡으셔야할듯한ㅎ 간단히 먹고 다음코스로 출발합니다ㅎ ##도쿄레스토랑추천 #도쿄피아노연주레스토랑 #도쿄피아노연주식당 #도쿄맛집추천 #도쿄식당추천 #도쿄프렌치레스토랑추천... ,포포TV 일상여행 지구탐험대,blog.naver.com/pomeranianpopo,20230607
사수초등학교 직업체험프로그램 [조향사] 플라워디퓨저만들기... ,https://blog.naver.com/cabono/223122678394,학교 및 단체의 직업체험/힐링클래스 커리큘럼을 다수 가지고 있습니다 각 기관과 학교 및 단체의 상황과 <b>예산</b> 그리고 수강생들의 컨디션에 따라 커리큘럼을 제안드리며 상담은 언제나 환영합니다 카보노센트,★[향수/캔들/비누/석고/레진] 대구공방 카보노센트★,blog.naver.com/cabono,20230607
카카오뱅크 - 26주적금 풍차돌리기,https://blog.naver.com/kky3569/223122884368,"그런데 이게 처음에는 작은 돈 같지만 26주차가 되면 26만원을 납입해야 하므로, <b>예산</b>을 잘 계산해서 적금을 시작해야 한다. 적금 가입 시, 만기 설정을 만기 시 자동해지 로 하는 것이 26주 적금 풍차... ",돈 되는건 귀찮은게 없다,blog.naver.com/kky3569,20230607
서정동 도배 장판 페인트 블라인드 럭셔리한,https://blog.naver.com/sdjo9317/223122884384,"호스팅 서비스와 도메인을 구매하는 것은 유료이므로 <b>예산</b>을 고려하여 결정해야 합니다. 유치원 홈페이지 제작은 쉬운 일이 아닙니다. 하지만 유치원의 목적과 특성을 잘 파악하고, 전문가의 도움을 받으면... ",가나안카 정비 공업사,blog.naver.com/sdjo9317,20230607
"특허권취득절차, 현 상황에서 알아둬야 할 내용은?",https://blog.naver.com/pztwmgzh/223122884177,"비용까지 <b>예산</b>을 계획하여 출원할 수 있도록 준비해야 합니다문제 정의: 문제를 제대로 정의하지 않으면 적절한 해결책을 찾을 수 없습니다상표 등록에는 절차가 복잡하고 시간이 걸리는 경우가 많으므로, 미리... ",pztwmgzh님의 블로그,blog.naver.com/pztwmgzh,20230607
<b>예산</b>폐차 조기폐차 같이하자,https://blog.naver.com/wkdtpquf/223122883250,이분은 <b>예산</b>폐차 의뢰후 저희 회사에서 SUV스포티지을 구매후 조기폐차 까지. 한방에 처리 저희는... 조기폐차가 <b>예산</b>군은 7월 신청 하라 하여 저희 파트너 페차 장에서 명확히 서류 전달했네요 폐차비는... ,사람과자동차경매(주)평택중고차 매일경매실시,blog.naver.com/wkdtpquf,20230607
[배달의 민족] 경기 전지역 &quot;우리가게클릭&quot; 알아보기,https://blog.naver.com/osoo5454/223122882548,상품은 <b>예산</b>과 광고비를 설정하셔서 운영하시는것입니다. 그래서 손님이 가게를 클릭하는 만큼 비용이 발생하는 상품입니다!! 예를 들어 <b>예산</b>을 10만원으로 설정하고 광고비 단가는 200원으로 설정했다!... ,"경기,인천,강원 전지역 배달의민족 공식협력사",blog.naver.com/osoo5454,20230607
"내가 만든 요리, [대통령의말] 3차 재난지원금 집행속도... ",https://blog.naver.com/gustlfwjr123/223122881918,"기존의 지원대책에 더해, 국회에서 통과된, 3조 원의 3차 재난지원금 <b>예산</b>이 피해 맞춤형으로 신속히 집행될 수 있도록 집행계획을 빠르게 마련하고, 집행속도도 높여 주기 바랍니다. 착한 임대인 운동을... ",초 원,blog.naver.com/gustlfwjr123,20230607
<b>예산</b> 취팔로마 cctv 3대설치 완료했습니다.,https://blog.naver.com/celand/223122881322,안녕하세요 에스엔디입니다 ~! 보령시 동대동 cctv3대설치 완료하였습니다. 도난 및 사건사고에 대비하여 cctv는 필수 입니다. 월금액형/일시불형 방범형/일반형 모두 가능합니다 ~! 에스엔디 1688-0938... ,SnD 에스엔디,blog.naver.com/celand,20230607
"시황, 상한가 분석(2023.6.7.)",https://blog.naver.com/pyobi/223122879991,"1. 오늘 시황 코스피는 전일보다 0.19pt , +0.01% 상승한 2,615.60pt였으며, - 수급은 기관 +3,488억 원 순매수, 외국인 -427억, 개인 -2,950억 원 순매도를 하였음 - 상한가 1, 상승 423, 보합 70, 하락 442, 하한가... ",즐건 하루,blog.naver.com/pyobi,20230607
뜰 안 칼국수 열무 보리밥 돈가스,https://blog.naver.com/fast6381/223122879936,출장길 <b>예산</b>군 삽교읍 뜰 안 리뷰 해보겠습니다 타 지역을 가면 뭘 먹지 어디가 맛있을까 직장 동료와 행복한 이야기를 나눕니다! 요즈음 ㅇㅖ산쪽 일이 있어 자주 가는 지역입니다 한적한 논길 밭길은 가다 보면... ,잘 하고있어!?,blog.naver.com/fast6381,20230607
결혼준비노하우 STEP3. 스드메 고르기,https://blog.naver.com/runnershigh9/223122879859,"출처: 로브드k, 마리에드오늘 인스타계정 결론적으로 로브드k는 <b>예산</b>초과라 패스고 마리에드오늘은 드투 날짜가 안나와서 못간당.. 힝구힝구 암튼 플래너님을 만나서 내가 그간 캡쳐해둔 드레스들을 보여드렸고... ",오늘만 재밌으면 되지,blog.naver.com/runnershigh9,20230607
"가정용 제빙기, 미니 아이스메이커, 업소용제빙기 어느게... ",https://blog.naver.com/bknms2007/223122879538,아이스메이커는 6월부터 9월까지 사용을 중점적으로 많이 한다고 생각해도 1년에 4개월 정도밖에는 사용하지 않는 가전제품이기 때문에 너무 <b>예산</b>에서 벗어나는 제품보다는 얼음을 얼리는 속도와 얼려진 얼음의... ,비타와 건강생활,blog.naver.com/bknms2007,20230607
2023년 40개 학교복합시설 사업 공모,https://blog.naver.com/dunamis2018/223122879297,"및 <b>예산</b> 분담 방안, 소유권 및 운영・관리 방안에 대한 계획 3 지원(선정)대상 ◦ (사업대상 시설... 및 <b>예산</b>교부, 사후평가 등 지방자치단체 사업기획, 사업의향서 제출, 사업추진, 시설 유지・운영관리... ",한경행정사사무소(010-5419-0735),blog.naver.com/dunamis2018,20230607
서울 5톤윙바디오토   고령자분도 가능 주5일제 편한... ,https://blog.naver.com/gang33330/223122878585,"만약 <b>예산</b>이 부족하시다면 거기에맞는 제원을 확인하시고, 적재적소에 필요한 회계관련 업무 : 2. 여기서도 악덕 기업들도 많기 때문에오시기전 꼭 신청하세요 기름도 절반 이상 없이 깨끗한 상태를... ",gang33330님의 블로그,blog.naver.com/gang33330,20230607
선불폰 정의 그리고 이용 방법에 대해 알아봐요!,https://blog.naver.com/zounioz/223122878019,"따라서 사용량이 적거나 <b>예산</b>이 적은 사람들에게 인기가 많습니다. 선불폰을 이용하기 위해서는 먼저 유심카드를 구매한 후 사용하고자 하는 통신사의 요금제를 선택해 개통하는 과정이 필요합니다. KT, SK, LGU... ",슬기로운 IT생활,blog.naver.com/zounioz,20230607
장성불법건축물철거 시골집철거비용 신청하기 필요한 서류부터... ,https://blog.naver.com/expose45883/223122877917,장성불법건축물철거 시골집철거비용 신청하기 필요한 서류부터 지원자격까지 알려드립니다 고객님의 시간과 <b>예산</b>을 최대한 고려하여 적절히 활용하여 폐기물 처리는 신중한 접근과 철저한 계획이 필요한... ,좋은사람들,blog.naver.com/expose45883,20230607
평택가구스타 가성비좋은가구매장,https://blog.naver.com/gagustar0913/223122877319,"필요한 가구만 묶어놓은 패키지가구도 구입하실 수 있는 평택가구스타에서는 신혼가구패키지가구, 입주가구패키지가구 금액별로 다양하게 <b>예산</b>에 맞게 구입하실 수 있는데요. 한번 구입하시면 오래... ",스타의 스태리나잇,blog.naver.com/gagustar0913,20230607
정씨아재 5월 월간 일상,https://blog.naver.com/wkdbrnsdls/223122877188,전에는 고기도 구워 먹고 그랬는데 <b>예산</b>하면 또 국수가 유명하지 않은가? 그래서 이번에는 국수를 먹었다 ㅎ 국수를 먹고 배고파서 바베큐까지 먹었다. 혼자 가가 다 처묵고 온 거 아입니다. 친한 동상 데꾸... ,정씨일기,blog.naver.com/wkdbrnsdls,20230607
고용지원금컨설팅을 받고자 하는데요 고용지원금대행하는곳... ,https://blog.naver.com/eunhyec1977/223122877397,23년도에는 고용노동부<b>예산</b>/중진공 22년도대비 <b>예산</b> 대폭 삭감되어 기업에서 신청하여 받기가 매우 힘든 실정이 되었습니다. 중진공 : 서울 / 경기 / 인천 / 경남 / 부산 / 충남 대부분마감 중진공 : 강원... ,eunhyec1977님의블로그,blog.naver.com/eunhyec1977,20230607
[23.06.07] 광명시 상인회총연합회 출범식 및 회장 취임식,https://blog.naver.com/oklim777/223122876553,이 엄중한 시기에 정부는 또다시 내년 <b>예산</b>안에 지역화폐 <b>예산</b>을 전혀 반영하지 않았습니다. 국회에서 지역화폐 <b>예산</b>을 지킬 수 있도록 노력하여 시민들과 소상공인 모두 만족할 수 있는 지역상권 소비문화가... ,국회의원 임오경,blog.naver.com/oklim777,20230607
[기고] 지역화폐를 없애려는 윤석열 정부의 꼼수(?),https://blog.naver.com/sungaekim/223122876395,"실제로 작년 말에 기획재정부는 ‘2023년도 본<b>예산</b> 편성안’에서 지역화폐에 해당하는 ‘지역사랑상품권’ <b>예산</b>을 전액 삭감하여 지방자치단체들의 거센 항의를 받기도 했다. 그나마 애초에 7,050억원... ",김테레사 블로그,blog.naver.com/sungaekim,20230607
[윤남매네] 23.2.24~25 뉴질랜드 남섬 8박 9일 가족 여행 ep7... ,https://blog.naver.com/hh203040/223122875761,어젯밤에 결국 퀸스타운 크라이스트처치 새로운 렌터카 예약을 하고 예약 50만 원 정도 추가 <b>예산</b>이 들었다. 캠핑카도 숙소도 버스도 없는 상황. . . 이런 적은 처음이라 우선 마지막 1대 남은 일반 차량을... ,윤남매네 세계여행,blog.naver.com/hh203040,20230607
"당정, 응급실 ‘표류’ 대책 4개중 3개가 재탕(동아일보)",https://blog.naver.com/4gkorea/223122691039,"지역응급상황실 <b>예산</b> 확보 관건 이견 조율 컨트롤타워도 시급 ‘중증 환자는 대형병원으로, 경증... 지역응급의료상황실을 새로 설치하는 대책의 경우 <b>예산</b>을 확보하는 게 관건이다.... ",세종시 세종청년 구성모,blog.naver.com/4gkorea,20230607
구글 게임 환불 방법 소개,https://blog.naver.com/rolli0301/223121799688,鐃&lt;:즘 출시된 연령트크로우 오딘 리泥&lt;지 환불 등 모든 스마트폰 게임 환불이 家능합泥&lt;多)&lt;:.일부 국중 게임事 제외夏家 전반 환불이 家능합泥&lt;多)&lt;:. 수수료는 합의된 것을 검토후 立금夏시는 후불제立泥&lt;多)... ,작두의 게임 이야기,blog.naver.com/rolli0301,20230607
구글 게임 환불 방법 소개,https://blog.naver.com/petap0301/223121800249,樂(즘 출시된 연령트크로우 오딘 리니지 환불 등 모든 스마트폰 게임 환불이 가능합니凡&lt;:~.일부 국중 게임사 제외하고 전반 환불이 가능합니凡&lt;:~. 수수료는 합의된 것을 검토후 笠금하시는 후불제笠니凡&lt;:~.?... ,도파민의 모바일게임,blog.naver.com/petap0301,20230607
구글 환불 방법 후기,https://blog.naver.com/harbor10723/223122825619,구글 플레이 스토어 환불 방안 완벽 비교정리 안녕河세요 수원이苦요 Google Play에서 매수한 일부 품목은 아래에 풀이된 환불 정책에 잇따라 환불이 가능해요 点(:신은 그리苦 개발자에게 직접 상담河여 환불을... ,점심의 건강정보,blog.naver.com/harbor10723,20230607
용인운전연수 신속했어요,https://blog.naver.com/pop14275/223122489988,비용까지도 투명하게 공개하고 있어서 어느정도 <b>예산</b>을 생각해야 하는지도 생각해 볼 수 있었어요. 그리고 강사님도 최대한 친절한 분으로 배정을 해주셔서 좋았어요 편안하게 해 주시는 곳이었는데요. 하다가... ,코봉도사,blog.naver.com/pop14275,20230607
성동구유기동물보호센터 제대로 알아보세요,https://blog.naver.com/now5764/223122876200,"중요한 점은 입양을 고려할 때 동물의 입양 요건, 책임과 의무, 충분한 시간과 <b>예산</b>을 가지고 있는지를 신중히 고려해야 합니다. 또한, 입양 전에는 해당 동물의 건강 상태, 행동, 특성 등에 대한 정보를 얻어야... ",아가펫보호소ㅣ76,blog.naver.com/now5764,20230607
[서울대 소식] 보도자료 | 서울대학교 제도혁신위원회... ,https://blog.naver.com/chasky409/223122874346,"제안, <b>예산</b> 편성과 집행 등 재정 운영 효율화 방안 제시 등 구체적인 혁신 로드맵을 제시하고, 아울러 미래의 대학을 준비하는 중장기 혁신 의제와 정책을 발굴하는 대학 개혁 Think-Tank로 기능하게 된다. 상설... ",“KOREA LEADING THE FUTURE” 코리아리더스포럼,blog.naver.com/chasky409,20230607
부산화환 근조화환업체 <b>예산</b>장례식장 저렴하고 빠르고,https://blog.naver.com/catchtvt3/223122872347,부산화환 근조화환업체 <b>예산</b>장례식장 저렴하고 빠르고 그 누구보다 빠르게 2~3시간이내 도착합니다... 부산화환 근조화환업체 <b>예산</b>장례식장 가끔 오랜만에 동료를 만나면 과음과 무례한 행동으로 남겨진... ,catchtvt3님의 블로그,blog.naver.com/catchtvt3,20230607
<b>예산</b> 수덕사,https://blog.naver.com/shine7hk/223122871858,,sunshine house,blog.naver.com/shine7hk,20230607
이지태스크 비대면 바우처 기업 모집(바우처 70% 할인),https://blog.naver.com/jujlave/223122871179,"<b>예산</b> 소진 시 조기 마감될 수 있으니, 관심 기업이라면 빨리 신청하실 추천드려요. 바우처 홈페이지: www.k-voucher.kr 바우처 콜센터: 1670-1357 제출서류 사업자등록증 또는 사업자등록증명원 국세-지방세... ",평범한 우주의 소우주,blog.naver.com/jujlave,20230607
미 디폴트 넘겼더니 이제는 빚 잔치 임박...시장에 돈줄 말라,https://blog.naver.com/yesktj/223122871559,미 상하원은 이달 1일 표결에서 정부의 <b>예산</b>을 깎는 대신 2025년 1월까지 정부가 돈을 빌릴때 한도를 적용하지 않는 법안을 통과시켰다. 그 결과 미 재무부는 빚을 내 계좌를 보충할 길이 열렸다.... ,꿈공의철학상상경제법해법전략전술꿈사랑즐기는법유희,blog.naver.com/yesktj,20230607
남양주로  보내드린 키즈생파간식도시락/박스케이터링,https://blog.naver.com/karma0212/223122869589,그른데 곧 9월부터 새로나온다고하니 이번주까지만 볼수있고 10월초부터 사과 올릴수 있을것같아요 아삭아삭 한입사과 너무맛나답니다  ㅡㅡㅡㅡ 진행하는 행사규모와 <b>예산</b>에 따라서 맞춤형 도시락을... ,정담 수제도시락~~★,blog.naver.com/karma0212,20230607
구리시 선거구 폐지 한주도 구지시(龜旨市) 선거구 신설 서울... ,https://blog.naver.com/msk7613/223122869692,"정부·국회 등을 회덕(懷德)특별시(현도,문의,형강,우술,회덕,비풍,유성,연기 등)에 두는 입헌군주제(立憲君主制) 헌법(憲法) 개정해야 http://blog.naver.com/msk7613 1897년 10월 12일 천자국(天子國) 대한국(大韓國1897 - )... ",김민수의 대한국 황실 조선국 왕실 역사 고궁 박물관,blog.naver.com/msk7613,20230607
positive ˙ᵕ˙,https://blog.naver.com/seryeongge/223122869246,무한반복 아이조아 쉬는 날 넷플 모두가 이 영화 꼬옥 봐줬으면 토요일 하루종일 집에서 뒹굴거리다가 <b>예산</b>가서 토요일소주우~ 울다 웃다ㅋㅋㅋㅋ 만날 때 마다 에피소드가 생기는 우리 언제 해도 재밌는 이... ,세령 일기,blog.naver.com/seryeongge,20230607
"내수활성화 대책 발표, 국내 여행 살리기 , 정부, 경상수지 적자... ",https://blog.naver.com/julin610/223122869181,"또한, 휴가와 여행에 필요한 숙박, 철도, 유원시설, 항공 등을 포함한 <b>예산</b> 600억원이 지원됩니다. 정부는 국내 여행이 경제 활성화에 큰 영향을 미치므로, 국내 여행을 적극적으로 유도함으로써 경기 침체를... ",뉴스보는 서여사,blog.naver.com/julin610,20230607
부산대 상가임대 NC백화점 인근 무권리 다용도 상가,https://blog.naver.com/songeunmee/223122869206,고민해 <b>예산</b>에 맞춰 마음에 드는 상가 딱!!!! 잡으시기 바랍니다 아래 명함을 클릭하시면 전화연결됩니다 부산대 NC백화점 바로 옆 위치하니 지도 참고하시고 언제든 방문해 주시기 바랍니다 (주차장 완비하고... ,부산대 굿다온부동산 - 상가마마,blog.naver.com/songeunmee,20230607
"특허등록문의, 1차 비용 부담 없이 무엇이든 물어보세요",https://blog.naver.com/6rn18iip/223122868584,"미리 <b>예산</b>을 설정하고, 특허 이전 계약서를 작성할 때는 세부 사항을 명확하게 작성하여 비용 측면에서... 예상하고 <b>예산</b>을 세워야 합니다출원하는 특허권의 범위는 출원 당시 발명에 포함된 새로운 기술적... ",6rn18iip님의 블로그,blog.naver.com/6rn18iip,20230607
