title,link,description,bloggername,bloggerlink,postdate
&apos;청주 지하철&apos; &quot;사실상 확정&quot;...교통체계 획기적 변화 전망,https://blog.naver.com/6604ksk/223122867935,&lt;녹취&gt;박종복 공동대표 청주도심통과 충청권광역철도 쟁취 범시민비대위 &quot;(정부는)관련 <b>예산</b>을 편성 적극 지원함으로서 충청권 광역철도가 조기에 착공될 수 있도록 최선의 노력을 다해야 한다&quot; 하지만... ,선빵임다님의 블로그,blog.naver.com/6604ksk,20230607
"ⅩⅠ. 가격규제, 독과점 및 불공정거래 규제, 자율규제",https://blog.naver.com/kjooh9/223122868161,가격규제: 독과점산업의 가격규제 1. 보편적 가격규제 방법: 서비스비용 가격결정 독과점업체가 생산공급하는 재화나 서비스의 가격규제에 가장 보편적으로 사용되고 있는 방법은 서비스비용 가격결정... ,"안녕하세요, 형빛입니다.",blog.naver.com/kjooh9,20230607
창호시공 KCC 로이유리 도매가격으로 교체,https://blog.naver.com/haksjy91/223122728519,<b>예산</b> 범위를 초과하지 않으면 전체적으로 창호시공을 하기로 마음먹었는데 견적낸 걸 보니 모두... 그러다 보니 가격적인 부분에서 다른 곳에 비해 메리트가 있었고 자재 퀄리티를 업그레이드해도 <b>예산</b> 내에... ,서울에 사는 한 여자,blog.naver.com/haksjy91,20230607
대한민국 국군의 암울한 현실.jpg,https://blog.naver.com/xnejfdl28/223122867510,&quot; 김병주 국회의원 &quot;국방부는 이런 것을 올리라고 하면 <b>예산</b>이 없고 기획재정부가 반대한다고 계속 얘기합니다. 기획재정부를 설득을 시켜야죠. 그동안 사실은 군에서 국방 <b>예산</b>을 쓸 때 최우선 순위가 첨단무기... ,알아두면 쓸데없는 잡다한 이야기들,blog.naver.com/xnejfdl28,20230607
후쿠시마 오염수 방류 논란,https://blog.naver.com/yunou21c/223122867003,"#1, #2, #3, 해당 영상 2018년~2020년, 일본 부흥청이 원전 사고 풍문을 줄이기 위해 10억 1600만엔 <b>예산</b>... # 2020년 12월 16일, 일본 정부가 오염수 해양 방류 계획의 안전성을 주장하는 홍보 <b>예산</b>을 책정했다.... ",평강,blog.naver.com/yunou21c,20230607
대구웨딩박람회 상담 견적 주의사항 호갱 조심해,https://blog.naver.com/teemogogo/223122867080,친구 중 하나가 내년에 결혼을 한다는데 <b>예산</b> 비중을 어떻게 나눌지 고민하더라고요. 그러면서 예물에 쓸 비용을 차라리 다른 분야에 투자하는게 좋지 않나 하는 말을 꺼냈는데요. 말이 끝나기도 전에 모두가... ,케넨의 하루 - 신혼일기,blog.naver.com/teemogogo,20230607
2종소형 면허시험연습장,https://blog.naver.com/99337347/223122867666,"용인, 안산, 인천, 충북, <b>예산</b>, 대전 시험장에서 가까운 안산라이더스 * 실사간 연습시간 비용 문의... 도봉2종소형오토바이 #안산2종소형 #용인2종소형 #인천2종소형 #충북2종소형 #<b>예산</b>2종소형 #대전2종소형",오토바이면허준비 코스 연습장,blog.naver.com/99337347,20230607
송영길 “‘김건희 녹취록’·‘이정근 녹취록’ 중 뭣이... ,https://blog.naver.com/sungaekim/223122866967,"국가 <b>예산</b>인 검찰 특수활동비 돈봉투와 전당대회 돈봉투 논란 중 무엇이 중요하냐”고 질문했다.... 국가 <b>예산</b> 검찰 특수활동비 돈봉투와 전당대회 돈봉투 논란, 무엇이 중요한가요? 이원석 검찰총장에게... ",김테레사 블로그,blog.naver.com/sungaekim,20230607
<b>예산</b> 대흥 슬로시티,https://blog.naver.com/lalalong/223122866139,"웃고 손바닥정원과 들꽃, 풍경에 절로 힐링이 되었다. 가을에 다시 오고 픈 <b>예산</b> 백종원의 고향으로만 알았던 <b>예산</b> 이제는 대흥 슬로시티 오래된 역사와 이야기가 있는 예쁜 마을에서 우리집 추억 거리가 되었다. ^^",Inter Stella Lee,blog.naver.com/lalalong,20230607
수원도배의 향기로움과 호메실동 아름다움 원룸 으로,https://blog.naver.com/sekxinyu/223122866370,"우리는 고객의 시공내용을 정확히 판단하고 시공<b>예산</b>과 일정을 고려하여 최적의 도배 솔루션을 제공합니다. 우리는 고객의 만족을 최우선으로 생각하며, 최상의 서비스와 결과물을 제공하기 위해 노력할... ",하연 이야기,blog.naver.com/sekxinyu,20230607
"6월 1-7일/일상기록, 대만 여행 계획, 당근, 애틀란타 일정... ",https://blog.naver.com/live_together_/223122865792,숙소가 급하기 때문에 대충 틀만 잡고 <b>예산</b>도 두루뭉술하게 잡았다. 숙소 사실 에어비엔비 하려고... 현재 <b>예산</b>을 생각보다 많이 잡아서 살짝 돌려줄까 고민 중. <b>예산</b>을 돌려주기로 결정함! 그래서 1인당 80으로... ,PING PING,blog.naver.com/live_together_,20230607
배스낚시 : 낚시여행 2일차 <b>예산</b> 예당저수지 배스낚시 정보... ,https://blog.naver.com/13pjy/223122865819,새로운 포인트 도전 가즈아!!!! 낚시 만세!!! #배스 #낚시 #배스낚시 #<b>예산</b>배스 #예당지배스 #예당저수지배스 #팀칸베이츠 #이글스틱 #칸베이츠 #이글스틱ml #js컴퍼니 #빅소드B3 #유정피싱 #엑사드ex5,낚시 가즈아,blog.naver.com/13pjy,20230607
WAR 커뮤니케이션-7.SNS는 괴력이다 : 뉴미디어를 알아야... ,https://blog.naver.com/gmhuman/223122866061,"그러한 시스템을 갖춰나가기 위해서는 시간과 <b>예산</b>, 기술확보가 우선되어야 한다. 넷째, 약간 별다른 문제라고 생각되지만, 장병들의 휴대폰 보유를 어떻게 해야할지도 고민스럽다. 과거의 전쟁에서는 편지를... ",밀컴 & 비컴 (military & business communication),blog.naver.com/gmhuman,20230607
2019년 1회 직업상담사 2급실기 기출문제,https://blog.naver.com/jmhen/223122866036,또는 <b>예산</b>제약 : 제품시장의 형태와 기업경영에 필요한 비용과 이윤 등이 노사관계에 영향을 미친다 주체들의 세력관계 : 노사관계를 포함한 사회 내 주체들 간 세력관계에 영향을 미친다 8. 표준화된... ,NEW START,blog.naver.com/jmhen,20230607
김천꽃집 로지데이즈 m사이즈꽃다발,https://blog.naver.com/rosydays1004/223122865498,"김천꽃집 김천교동꽃집 로지데이즈m사이즈 꽃다발 농협 김천시지부 에서 주문주셔서, 예쁘게 만들어드렸습니다 기업꽃다발 도 주문주시면, <b>예산</b>에맞게 풍성하게 만들어드려요오 우아한느낌의... ",ෆ 김천꽃집 로지데이즈 ෆ,blog.naver.com/rosydays1004,20230607
"주민등록증 유효기간, 10년마다 갱신",https://blog.naver.com/pa3722/223122865271,"사진: Unsplash의Monica Sauro <b>예산</b> 낭비 안 하면서, 효율적으로 잘 검토해서 하면 좋을듯하다. 사각지대에 있는 나이 많은 어르신들도 소외 받지 않게 잘 배려해서 좋은 정책을 만들면 참 좋을 듯하다.",투자 그리고 소소한 일상,blog.naver.com/pa3722,20230607
체계적인 관리법 수원두피문신,https://blog.naver.com/puminyou1/223122863983,그런데 둘이 합쳐도 600만 원이니까 속으로 정말 여기 오길 잘했다 싶으면서 나머지 <b>예산</b>으로 제주도로 가족여행이나 다녀오면 좋겠다 싶더라고요. 저희 아버지는 다 합쳐서 2만 4천 샷을 시술받으셨는데요.... ,너의 이름은,blog.naver.com/puminyou1,20230607
원당 안경점 / 원당 안경은 [다비치 안경 - 원당시장사거리앞점]... ,https://blog.naver.com/yesyall/223122864089,단돈 만원에 팔고 있음 ㅋㅋ 그리고 <b>예산</b>이 빠방하신 분들은 좋은 브랜드의 안경테를 고를 수도 있다.... 원하는 <b>예산</b>이 있다면 그거에 맞게 렌즈와 테를 맞출 수 있다. 우리도 우리가 원하는 <b>예산</b>으로 잘 맞춰서... ,놀러와,blog.naver.com/yesyall,20230607
채사장의 지대넓얕(+5월 5주차&amp;6월 1주차 주간정산),https://blog.naver.com/danahlife/223122863949,"미리 예방해서 피부과 가는 비용 줄이려고 ㅋㅋㅋ 다음주 <b>예산</b>에 선크림 구매비용도 넣었따.... 드디어 다음달에 여행갈 계획을 생겨서 구매했다. * 다음주 <b>예산</b>은 식사 3만원, 품위유지비(선크림) 2만원 !",love myself :),blog.naver.com/danahlife,20230607
20만원선물 선택해야 하는이유,https://blog.naver.com/fcxv5204/223122862950,"변동비 <b>예산</b>은 완전 초과이다 여행 항공권 등이 포함되긴 했지만 거의 100만 원 넘게 초과했다... 식비는 <b>예산</b> 45만 원에 맞게 잘 사용을 했고, 주거 생활비는 스킨, 로션과 차량 번호판 등을 구매하느라 5만 원... ",늦은향수,blog.naver.com/fcxv5204,20230607
"봄,낭만일기 3편",https://blog.naver.com/minjea4807/223122863589,귀엽드라^-^ 어쩌다보니 취향찾음ㅋㅋ _ 돈 없다구요 돈 없는데 <b>예산</b> 싹싹 끌어서 다썼는데.. 바라는게 많으신..... 나 시험공부 언제하는데요?... _ 중꺾마 이번 학기가 빡세다는걸 너무 늦게 깨달아버린 중꺾마... ,Jam&apos;s Diary,blog.naver.com/minjea4807,20230607
"구로구의회, 제318회 정례회 제2차 본회의 안건 의결",https://blog.naver.com/dbilbo/223122863545,"의회는 앞서 지난달 23일 제1차 본회의를 시작으로, 24일부터 6월 2일까지 각 상임위원회와 <b>예산</b>결산특별위원회 활동을 통해 2022회계연도 예비비 지출 및 결산승인과 의원대표발의 조례안 등 각종 안건을... ",동방일보,blog.naver.com/dbilbo,20230607
늘어나는 생계형 대출… 제주서 최초로 ‘상환 지원’,https://blog.naver.com/hun4339/223122863384,이에 따라 제주도는 제1회 추가경정<b>예산</b>을 통해 확보한 10억원을 이용해 전국 최초로 ‘고금리 대안자금’의 상환을 지원하기로 했다. 고금리 대안자금은 법정 최고금리인 20%를 넘는 불법 사금융 피해를... ,힐링캠프,blog.naver.com/hun4339,20230607
수많은 업체 비교 후 계약한 웨딩 본식스냅 :: 더데이그라피... ,https://blog.naver.com/tlswl0_/223122863508,고민끝에 내린 결론은 &lt;1&gt; <b>예산</b>에 적합했습니다 &quot;100만원 초반대로 2인 스냅을 찾아보자&quot; 였습니다... com/thedaygraphy-/223115293990 여기까지 2인 촬영으로 합리적인 <b>예산</b>에 적합한 본식 스냅촬영으로 후회없는... ,지뽕이의 일기_Happy Day,blog.naver.com/tlswl0_,20230607
자동차보험료비교견적사이트 좋은 점 살펴보고 신중히... ,https://blog.naver.com/surgery654/223122862426,복지<b>예산</b>도 잘 주무르네... <b>예산</b> 삭감할라믄 니놈들 세비나 삭감 약간 해라. 룸싸롱가서 개지랄하는 <b>예산</b>도 약간 삭감하구... * 무엇인가를 얻고 소유할 때의 기쁨보다 버리고 나눠줄 때의 행복은 더... ,위로,blog.naver.com/surgery654,20230607
거여동간판 간판글씨체 간판설치 했어요,https://blog.naver.com/urge2zpi/223122862325,간판 공모전에서 2006년도에 간판 개성사업을 하면서 시작한 것이 간판의 조명도 입체 간판으로 편성된 <b>예산</b> 등 진행하였었죠. 확실히 눈에 띄기 때문에 스카이 장비 차량이 도착하자마자 설치를 마친... ,독특한 사진작가,blog.naver.com/urge2zpi,20230607
<b>예산</b> 신리성지,https://blog.naver.com/yhyang_hae/223122862587,"지난 현충일에 다녀온 충남 <b>예산</b>에 있는 신리성지! 불교 신자의 아들로서 살아온 지도 어언 30여년, 이곳에서 극락.. 아니 천국을 보았습니다... 홀리 피-쓰! #sigma85mmf14dgdn 출사에 함께해 준 의리파... ",양사원 블로그,blog.naver.com/yhyang_hae,20230607
광주운전연수 여자강사님 과 06월7일 수요일 간단한 신문뉴스,https://blog.naver.com/dldudwn0003/223122862710,정부가 지난해 국회에서 무산된 '지역화폐 <b>예산</b> 전액 삭감'을 다시 추진하기로 하면서 여야가 다시 <b>예산</b>안을 두고 힘겨루기에 나설 것으로 보입니다. 민주당은 '이재명표 <b>예산</b>'으로 불리는 지역화폐사업을... ,광주 여자 운전 연수,blog.naver.com/dldudwn0003,20230607
[상시접수][산업통상자원부]2023년 가상검증플랫폼 구축사업... ,https://blog.naver.com/ilsinbc/223122862199,및 <b>예산</b> 등) 검토 후 이를 제공 [첨부파일] 첨부파일 가상검증플랫폼 구축사업 수혜기업 모집 공고.png 첨부파일 (서식 제1호) 가상검증플랫폼 구축사업 수혜기업 모집 지원 신청서.hwp 첨부파일 (서식 제2호)... ,경영지도사 김진영의 105세 경영,blog.naver.com/ilsinbc,20230607
장안동 헬스장 고르는 방법,https://blog.naver.com/rindo1/223122860599,좋아요 <b>예산</b>에 맞고 필요한 편의 시설을 제공하는 헬스장을 찾는게 가장 좋겠죠 마지막으로는 운동 분위기가 어떤지 보면 좋아요 운동할 시간에 체육관을 방문하여 전반적인 분위기를 관찰하는것도 팁이예요... ,rindo의 여행스케치,blog.naver.com/rindo1,20230607
테헤란에서 최초로 공개하는 생생한 특허후기,https://blog.naver.com/szpna9dt/223122861307,충분히 <b>예산</b>을 결정해야 합니다아이디어를 실제로 구현할 수 있는 기술적인 가능성이 있는지... 비용까지 <b>예산</b>을 계획하여 출원할 수 있도록 준비해야 합니다출원서 작성 시 주의사항: 출원서를 작성할 때는... ,szpna9dt님의 블로그,blog.naver.com/szpna9dt,20230607
기후와 역사,https://blog.naver.com/gilldong2000/223122860479,"© lwalz, 출처 Unsplash 기후변화가 태양의 수축운동과 지구의 공전과 자전 결과라고 하는 학자들을 기득권(유엔,각국정부,각국언론들,정부<b>예산</b>을 받기 위해 데이터를 조작하는 비양심과학자들...)들은 일명... ",J.S.P.의 BLOG,blog.naver.com/gilldong2000,20230607
[공짱 분양뉴스] 천안·홍성 국가산단 동시 선정에 삼성 56조... ,https://blog.naver.com/gongzzanginc/223122856977,홍성 국가산단에 이어 <b>예산</b>에 농생명 그린바이오 클러스터 조성계획도 야심 차게 추진하고 있다. 서북부에 편중된 충남 경제를 도청이 소재한 내포신도시까지 확장하며 '힘쎈 충남'의 '경제 지도'를 새로... ,공짱,blog.naver.com/gongzzanginc,20230607
"학술대회, 심포지엄, 포럼, 각종 행사 운영은 앨리스필름!",https://blog.naver.com/sweetks1220/223122860251,"또한 합리적인 행사비용을 제공해드리기 위하여 올인원하우스시스템으로 운영되고 있어 <b>예산</b> 절감의 효과와 퀄리티를 동시에 챙겨보실 수 있죠. 행사인쇄물제작, 행사케이터링, 행사의전도우미/아니운서... ",앨리스 스튜디오,blog.naver.com/sweetks1220,20230607
파주 금은방 커플링 목걸이 너무 예뻤던 곳 (일산),https://blog.naver.com/xenin234/223122739085,정해둔 <b>예산</b>이 있었는데 다행히도 팔찌까지 구매해도 괜찮은 정도였어요. 여기가 화려하고 유니크한... 직접 <b>예산</b>에 맞도록 저렴하게 맞춰주셔서 부담되지 않았던 것 같아요. 이래서 파주 일산 금은방 매장 같은... ,제리제리고고,blog.naver.com/xenin234,20230607
서울 중고오토바이매입 / 중고바이크매입!!... ,https://blog.naver.com/power0729/223117885423,<b>예산</b>오토바이매입!! 공주오토바이매입!! 홍성오토바이매입!! 부여오토바이매입!! 논산오토바이매입!! 횡성오토바이매입!! 원주오토바이매입!! 홍천오토바이매입!! 진천오토바이매입!! 음성오토바이매입!!... ,DM바이크,blog.naver.com/power0729,20230607
"새만금개발청, 사이버 위협 즉각 대응 체계 완비",https://blog.naver.com/taenafit/223122510762,"ㅇ ‘부처합동 사이버안전센터’는 국가정보원과 협력해 <b>예산</b>, 공간, 시설 등을 공유하는 시스템으로, ’21년 인사혁신처 등 4개 기관*이 구축사업을 추진해 왔고, ’22년 새만금개발청과 질병관리청이... ",Ubit의 자유로운 일상,blog.naver.com/taenafit,20230607
(미국 주식)개인 금융의 미래: 핀테크 50 2023,https://blog.naver.com/egg8118/223122859504,"초록불 가족당 월 $4.99부터 시작하는 구독 기반 앱은 자동 수당, 집안일 추적, <b>예산</b> 책정 및 직불 카드를 제공하며 모두 부모가 감독합니다. JPMorgan Chase는 Greenlight의 화이트 라벨 기술을... ",우리는 고통을 넘어 건너편에 도달해야 한다 NBC,blog.naver.com/egg8118,20230607
김포시폐차장 산타페 폐차보상금과 고철비 얼마나 받을 수 있을까,https://blog.naver.com/newcarinfor/223122853317,다만 조기폐차의 경우 지자체의 <b>예산</b>으로 지급되기 때문에 <b>예산</b>이 소진된다면 지원금 수령이 어려울 수 있으므로 빠르게 신청하고 받아보시는 것이 중요합니다. 조기폐차를 신청할때 필요한 서류는 명의자 별로... ,Car박사 이부장,blog.naver.com/newcarinfor,20230607
내포 20평 1층 식당 월세 임대/양수양도 가능/업종전환가능... ,https://blog.naver.com/dal_eeee/223122858166,"(홍성+<b>예산</b>) 상가,사무실 전문 임대, 매매 문의 041-633-9639 내포 신도시 중심상업지역 내 식당... 25 매물설명 식당 추천 내포(홍성+<b>예산</b>) 상가,사무실 전문 임대, 매매 문의 041-633-9639 해가뜨면... ",해가뜨면부동산/041-633-9639,blog.naver.com/dal_eeee,20230607
"특허거절사유, 당황하지 마세요 이것만 알면 극복 가능합니다",https://blog.naver.com/szpna9dt/223122858278,"비용을 <b>예산</b>에 맞춰야 합니다따라서, 특허 침해 위험성을 파악하여 미리 대비하는 것이 중요합니다아이디어에 대한 법적인 문제가 있는지 확인하고, 출원 전에 미리 대처하세요특허권 구매 비용 외에도... ",szpna9dt님의 블로그,blog.naver.com/szpna9dt,20230607
가회동성당 24년도 상반기 혼배추첨 성공,https://blog.naver.com/creampillow_/223122857746,"대략 비슷한 시기에 추첨을 진행하고 공지사항 역시 비슷할테니 미리 <b>예산</b>이나 추첨 계획을 세울 수... 자 이제 여기까지 하면, 어느정도 <b>예산</b>도 파악되고 마음에 드는 성당도 한 번 더 걸러진다. 그렇다면 이제... ",희소만의 방,blog.naver.com/creampillow_,20230607
6월 어린이보험(조합설계),https://blog.naver.com/na__aeri/223122857980,"장기간내는 보험료인 만큼 처음에 가입할때 끝까지 유지 할 수 있는지 <b>예산</b>을 정하는 것이 좋습니다. 어린이보험 추천플랜 30세 여성 기분 추천플랜입니다. A사 [보험사 상품별로 성별, 연령, 직업에 따라... ",나애리보험,blog.naver.com/na__aeri,20230607
